{
  "emerging_technology": "REPLACE",
  "intended_application": "REPLACE",
  "organization": "REPLACE",
  "industry_sector": "REPLACE",
  "business_need": "REPLACE",
  "users_stakeholders": "REPLACE",
  "adoption_posture": "REPLACE",
  "capabilities_constraints": "REPLACE",
  "risk_consequence_context": "REPLACE",
  "management_question": "REPLACE",
  "time_horizon": "REPLACE",
  "additional_context": ""
}